author,comment,voteCount,replyCount,channel,country
@xeena01,A peine ces pas assez ces mieux qui meurent  tousse pour tout le mal qui on fait sur tout les enfants  tuer  à gaza et tuer chitanyaou,0,0,FRANCE24,France
@user-cs2sz4dv2f,,0,0,FRANCE24,France
@hindaclubhindaclub,Mais  biensur ils veulent faire comme en cisjordanie colonisation silencieuse mais on est pas dupe on oubliera pas,1,0,FRANCE24,France
@sabahamr8020,Par rapport au Gaza se n'est rien,0,0,FRANCE24,France
@haynsmunch2365,Chiffre à multiplier par 7.....,1,0,FRANCE24,France
@antar18,Plutôt 3000 morts et pas 115...les vrais chiffres cachés,1,0,FRANCE24,France
@hanti, plus de 1000 blessés  pour seulement 112 morts. Le ratio est abérant ,0,0,FRANCE24,France
@crechemokhtari7088,La Palestine appartient au palestinien,2,0,FRANCE24,France
